{
  "$schema": "http://json-schema.org/draft-07/schema#",
  "type": "object",
  "required": [
    "name",
    "version",
    "archetypes"
  ],
  "properties": {
    "name": {
      "type": "string"
    },
    "description": {
      "type": "string"
    },
    "version": {
      "type": "string"
    },
    "demographic_context": {
      "type": "string"
    },
    "archetypes": {
      "type": "array",
      "items": {
        "type": "object",
        "required": [
          "name",
          "opinion_pattern",
          "weight"
        ],
        "properties": {
          "name": {
            "type": "string"
          },
          "description": {
            "type": "string"
          },
          "opinion_pattern": {
            "type": "array",
            "items": {
              "type": "number"
            }
          },
          "weight": {
            "type": "number",
            "minimum": 0,
            "maximum": 1
          },
          "variance": {
            "type": "object"
          },
          "demographic_pattern": {
            "type": "object"
          }
        }
      }
    }
  }
}